{
  "power_state": "Deallocated",
  "provisioning_state": "Succeeded",
  "resource_health_status": "Unknown",
  "resource_health_annotation": "",
  "heartbeat_present": null,
  "heartbeat_last_received": null,
  "boot_diagnostics_status": "Unknown",
  "boot_diagnostics_error": "",
  "azure_vm_agent_status": "Unknown",
  "cpu_percent": null,
  "memory_available_mb": null,
  "memory_percent": null,
  "os_disk_latency_ms": null,
  "data_disk_latency_ms": null,
  "os_disk_percent_full": null,
  "app_health_status": null,
  "app_error_message": null,
  "nsg_allow_rdp_3389": null,
  "nsg_allow_ssh_22": null,
  "connection_troubleshoot_rdp": null,
  "connection_troubleshoot_ssh": null,
  "connection_troubleshoot_verdict": null,
  "monitor_agent_status": null,
  "ssl_cert_days_remaining": null,
  "last_backup_status": null,
  "last_backup_time": null,
  "data_completeness_percent": 11.54,
  "missing_signals": [
    "resource_health_annotation",
    "heartbeat_present",
    "heartbeat_last_received",
    "boot_diagnostics_status",
    "boot_diagnostics_error",
    "azure_vm_agent_status",
    "cpu_percent",
    "memory_available_mb",
    "memory_percent",
    "os_disk_latency_ms",
    "data_disk_latency_ms",
    "os_disk_percent_full",
    "app_health_status",
    "app_error_message",
    "nsg_allow_rdp_3389",
    "nsg_allow_ssh_22",
    "connection_troubleshoot_rdp",
    "connection_troubleshoot_ssh",
    "connection_troubleshoot_verdict",
    "monitor_agent_status",
    "ssl_cert_days_remaining",
    "last_backup_status",
    "last_backup_time"
  ]
}